{
  "id": "arashi_t4",
  "nodes": [
    {"id":0,"pos_m":[-0.7774,-2.195,0.15],"mass_kg":1.0776119,"pinned_to_chassis":false,"region":"RearBumper"},
    {"id":1,"pos_m":[-0.507,-2.195,0.15],"mass_kg":1.0776119,"pinned_to_chassis":false,"region":"RearBumper"},
    {"id":2,"pos_m":[0.507,-2.195,0.15],"mass_kg":1.0776119,"pinned_to_chassis":false,"region":"RearBumper"},
    {"id":3,"pos_m":[0.7774,-2.195,0.15],"mass_kg":1.0776119,"pinned_to_chassis":false,"region":"RearBumper"},
    {"id":4,"pos_m":[-0.7774,-2.195,0.4659],"mass_kg":1.0776119,"pinned_to_chassis":false,"region":"RearBumper"},
    {"id":5,"pos_m":[-0.507,-2.195,0.4659],"mass_kg":1.0776119,"pinned_to_chassis":false,"region":"RearBumper"},
    {"id":6,"pos_m":[0.0,-2.195,0.4659],"mass_kg":1.0776119,"pinned_to_chassis":false,"region":"RearBumper"},
    {"id":7,"pos_m":[0.507,-2.195,0.4659],"mass_kg":1.0776119,"pinned_to_chassis":false,"region":"RearBumper"},
    {"id":8,"pos_m":[0.7774,-2.195,0.4659],"mass_kg":1.0776119,"pinned_to_chassis":false,"region":"RearBumper"},
    {"id":9,"pos_m":[-0.7774,-2.195,0.68160003],"mass_kg":1.0776119,"pinned_to_chassis":false,"region":"RearBumper"},
    {"id":10,"pos_m":[-0.507,-2.195,0.68160003],"mass_kg":1.0776119,"pinned_to_chassis":false,"region":"RearBumper"},
    {"id":11,"pos_m":[0.0,-2.195,0.68160003],"mass_kg":1.0776119,"pinned_to_chassis":false,"region":"RearBumper"},
    {"id":12,"pos_m":[0.507,-2.195,0.68160003],"mass_kg":1.0776119,"pinned_to_chassis":false,"region":"RearBumper"},
    {"id":13,"pos_m":[0.7774,-2.195,0.68160003],"mass_kg":1.0776119,"pinned_to_chassis":false,"region":"RearBumper"},
    {"id":14,"pos_m":[-0.845,-2.0149999,0.15],"mass_kg":1.0776119,"pinned_to_chassis":false,"region":"FrameRear"},
    {"id":15,"pos_m":[-0.507,-2.0149999,0.15],"mass_kg":1.0776119,"pinned_to_chassis":false,"region":"FrameRear"},
    {"id":16,"pos_m":[0.507,-2.0149999,0.15],"mass_kg":1.0776119,"pinned_to_chassis":false,"region":"FrameRear"},
    {"id":17,"pos_m":[0.845,-2.0149999,0.15],"mass_kg":1.0776119,"pinned_to_chassis":false,"region":"FrameRear"},
    {"id":18,"pos_m":[-0.845,-2.0149999,0.4659],"mass_kg":1.0776119,"pinned_to_chassis":false,"region":"RearLeftQuarter"},
    {"id":19,"pos_m":[-0.507,-2.0149999,0.4659],"mass_kg":1.0776119,"pinned_to_chassis":false,"region":"FrameRear"},
    {"id":20,"pos_m":[0.0,-2.0149999,0.4659],"mass_kg":1.0776119,"pinned_to_chassis":false,"region":"FrameRear"},
    {"id":21,"pos_m":[0.507,-2.0149999,0.4659],"mass_kg":1.0776119,"pinned_to_chassis":false,"region":"FrameRear"},
    {"id":22,"pos_m":[0.845,-2.0149999,0.4659],"mass_kg":1.0776119,"pinned_to_chassis":false,"region":"RearRightQuarter"},
    {"id":23,"pos_m":[-0.845,-2.0149999,0.80939996],"mass_kg":1.0776119,"pinned_to_chassis":false,"region":"RearLeftQuarter"},
    {"id":24,"pos_m":[-0.507,-2.0149999,0.80939996],"mass_kg":1.0776119,"pinned_to_chassis":false,"region":"Trunk"},
    {"id":25,"pos_m":[0.0,-2.0149999,0.80939996],"mass_kg":1.0776119,"pinned_to_chassis":false,"region":"Trunk"},
    {"id":26,"pos_m":[0.507,-2.0149999,0.80939996],"mass_kg":1.0776119,"pinned_to_chassis":false,"region":"Trunk"},
    {"id":27,"pos_m":[0.845,-2.0149999,0.80939996],"mass_kg":1.0776119,"pinned_to_chassis":false,"region":"RearRightQuarter"},
    {"id":28,"pos_m":[-0.845,-1.7616665,0.15],"mass_kg":1.0776119,"pinned_to_chassis":false,"region":"FrameRear"},
    {"id":29,"pos_m":[-0.507,-1.7616665,0.15],"mass_kg":1.0776119,"pinned_to_chassis":false,"region":"FrameRear"},
    {"id":30,"pos_m":[0.507,-1.7616665,0.15],"mass_kg":1.0776119,"pinned_to_chassis":false,"region":"FrameRear"},
    {"id":31,"pos_m":[0.845,-1.7616665,0.15],"mass_kg":1.0776119,"pinned_to_chassis":false,"region":"FrameRear"},
    {"id":32,"pos_m":[-0.845,-1.7616665,0.4659],"mass_kg":1.0776119,"pinned_to_chassis":false,"region":"RearLeftQuarter"},
    {"id":33,"pos_m":[-0.507,-1.7616665,0.4659],"mass_kg":1.0776119,"pinned_to_chassis":false,"region":"FrameRear"},
    {"id":34,"pos_m":[0.507,-1.7616665,0.4659],"mass_kg":1.0776119,"pinned_to_chassis":false,"region":"FrameRear"},
    {"id":35,"pos_m":[0.845,-1.7616665,0.4659],"mass_kg":1.0776119,"pinned_to_chassis":false,"region":"RearRightQuarter"},
    {"id":36,"pos_m":[-0.845,-1.7616665,0.80939996],"mass_kg":1.0776119,"pinned_to_chassis":false,"region":"RearLeftQuarter"},
    {"id":37,"pos_m":[-0.507,-1.7616665,0.80939996],"mass_kg":1.0776119,"pinned_to_chassis":false,"region":"Trunk"},
    {"id":38,"pos_m":[0.0,-1.7616665,0.80939996],"mass_kg":1.0776119,"pinned_to_chassis":false,"region":"Trunk"},
    {"id":39,"pos_m":[0.507,-1.7616665,0.80939996],"mass_kg":1.0776119,"pinned_to_chassis":false,"region":"Trunk"},
    {"id":40,"pos_m":[0.845,-1.7616665,0.80939996],"mass_kg":1.0776119,"pinned_to_chassis":false,"region":"RearRightQuarter"},
    {"id":41,"pos_m":[-0.845,-1.5083332,0.15],"mass_kg":1.0776119,"pinned_to_chassis":false,"region":"FrameRear"},
    {"id":42,"pos_m":[-0.507,-1.5083332,0.15],"mass_kg":1.0776119,"pinned_to_chassis":false,"region":"FrameRear"},
    {"id":43,"pos_m":[0.507,-1.5083332,0.15],"mass_kg":1.0776119,"pinned_to_chassis":false,"region":"FrameRear"},
    {"id":44,"pos_m":[0.845,-1.5083332,0.15],"mass_kg":1.0776119,"pinned_to_chassis":false,"region":"FrameRear"},
    {"id":45,"pos_m":[-0.845,-1.5083332,0.4659],"mass_kg":1.0776119,"pinned_to_chassis":false,"region":"RearLeftQuarter"},
    {"id":46,"pos_m":[-0.507,-1.5083332,0.4659],"mass_kg":1.0776119,"pinned_to_chassis":false,"region":"FrameRear"},
    {"id":47,"pos_m":[0.507,-1.5083332,0.4659],"mass_kg":1.0776119,"pinned_to_chassis":false,"region":"FrameRear"},
    {"id":48,"pos_m":[0.845,-1.5083332,0.4659],"mass_kg":1.0776119,"pinned_to_chassis":false,"region":"RearRightQuarter"},
    {"id":49,"pos_m":[-0.845,-1.5083332,0.80939996],"mass_kg":1.0776119,"pinned_to_chassis":false,"region":"RearLeftQuarter"},
    {"id":50,"pos_m":[-0.507,-1.5083332,0.80939996],"mass_kg":1.0776119,"pinned_to_chassis":false,"region":"Trunk"},
    {"id":51,"pos_m":[0.0,-1.5083332,0.80939996],"mass_kg":1.0776119,"pinned_to_chassis":false,"region":"Trunk"},
    {"id":52,"pos_m":[0.507,-1.5083332,0.80939996],"mass_kg":1.0776119,"pinned_to_chassis":false,"region":"Trunk"},
    {"id":53,"pos_m":[0.845,-1.5083332,0.80939996],"mass_kg":1.0776119,"pinned_to_chassis":false,"region":"RearRightQuarter"},
    {"id":54,"pos_m":[-0.845,-1.255,0.15],"mass_kg":1.0776119,"pinned_to_chassis":false,"region":"FrameRear"},
    {"id":55,"pos_m":[-0.507,-1.255,0.15],"mass_kg":1.0776119,"pinned_to_chassis":false,"region":"FrameRear"},
    {"id":56,"pos_m":[0.507,-1.255,0.15],"mass_kg":1.0776119,"pinned_to_chassis":false,"region":"FrameRear"},
    {"id":57,"pos_m":[0.845,-1.255,0.15],"mass_kg":1.0776119,"pinned_to_chassis":false,"region":"FrameRear"},
    {"id":58,"pos_m":[-0.845,-1.255,0.4659],"mass_kg":1.0776119,"pinned_to_chassis":false,"region":"RearLeftQuarter"},
    {"id":59,"pos_m":[-0.507,-1.255,0.4659],"mass_kg":1.0776119,"pinned_to_chassis":false,"region":"FrameRear"},
    {"id":60,"pos_m":[0.507,-1.255,0.4659],"mass_kg":1.0776119,"pinned_to_chassis":false,"region":"FrameRear"},
    {"id":61,"pos_m":[0.845,-1.255,0.4659],"mass_kg":1.0776119,"pinned_to_chassis":false,"region":"RearRightQuarter"},
    {"id":62,"pos_m":[-0.845,-1.255,0.852],"mass_kg":1.0776119,"pinned_to_chassis":false,"region":"RearLeftQuarter"},
    {"id":63,"pos_m":[-0.507,-1.255,0.852],"mass_kg":1.0776119,"pinned_to_chassis":false,"region":"Trunk"},
    {"id":64,"pos_m":[0.0,-1.255,0.852],"mass_kg":1.0776119,"pinned_to_chassis":false,"region":"Trunk"},
    {"id":65,"pos_m":[0.507,-1.255,0.852],"mass_kg":1.0776119,"pinned_to_chassis":false,"region":"Trunk"},
    {"id":66,"pos_m":[0.845,-1.255,0.852],"mass_kg":1.0776119,"pinned_to_chassis":false,"region":"RearRightQuarter"},
    {"id":67,"pos_m":[-0.845,-0.94444996,0.15],"mass_kg":1.0776119,"pinned_to_chassis":false,"region":"FrameLeft"},
    {"id":68,"pos_m":[-0.507,-0.94444996,0.15],"mass_kg":1.0776119,"pinned_to_chassis":false,"region":"Cabin"},
    {"id":69,"pos_m":[0.507,-0.94444996,0.15],"mass_kg":1.0776119,"pinned_to_chassis":false,"region":"Cabin"},
    {"id":70,"pos_m":[0.845,-0.94444996,0.15],"mass_kg":1.0776119,"pinned_to_chassis":false,"region":"FrameRight"},
    {"id":71,"pos_m":[-0.845,-0.94444996,0.4659],"mass_kg":1.0776119,"pinned_to_chassis":false,"region":"Cabin"},
    {"id":72,"pos_m":[-0.507,-0.94444996,0.4659],"mass_kg":1.0776119,"pinned_to_chassis":false,"region":"Cabin"},
    {"id":73,"pos_m":[0.507,-0.94444996,0.4659],"mass_kg":1.0776119,"pinned_to_chassis":false,"region":"Cabin"},
    {"id":74,"pos_m":[0.845,-0.94444996,0.4659],"mass_kg":1.0776119,"pinned_to_chassis":false,"region":"Cabin"},
    {"id":75,"pos_m":[-0.845,-0.94444996,0.852],"mass_kg":1.0776119,"pinned_to_chassis":false,"region":"Cabin"},
    {"id":76,"pos_m":[-0.507,-0.94444996,0.852],"mass_kg":1.0776119,"pinned_to_chassis":false,"region":"Cabin"},
    {"id":77,"pos_m":[0.507,-0.94444996,0.852],"mass_kg":1.0776119,"pinned_to_chassis":false,"region":"Cabin"},
    {"id":78,"pos_m":[0.845,-0.94444996,0.852],"mass_kg":1.0776119,"pinned_to_chassis":false,"region":"Cabin"},
    {"id":79,"pos_m":[-0.6591,-0.94444996,1.1576444],"mass_kg":1.0776119,"pinned_to_chassis":false,"region":"Cabin"},
    {"id":80,"pos_m":[0.0,-0.94444996,1.1576444],"mass_kg":1.0776119,"pinned_to_chassis":false,"region":"RearGlass"},
    {"id":81,"pos_m":[0.6591,-0.94444996,1.1576444],"mass_kg":1.0776119,"pinned_to_chassis":false,"region":"Cabin"},
    {"id":82,"pos_m":[-0.845,-0.74445,0.15],"mass_kg":1.0776119,"pinned_to_chassis":false,"region":"FrameLeft"},
    {"id":83,"pos_m":[-0.507,-0.74445,0.15],"mass_kg":1.0776119,"pinned_to_chassis":true,"region":"Cabin"},
    {"id":84,"pos_m":[0.507,-0.74445,0.15],"mass_kg":1.0776119,"pinned_to_chassis":true,"region":"Cabin"},
    {"id":85,"pos_m":[0.845,-0.74445,0.15],"mass_kg":1.0776119,"pinned_to_chassis":false,"region":"FrameRight"},